{
  "id": "GT-028",
  "version": "1.0",
  "name": "Create deal request",
  "description": "User wants to create a new deal",
  "category": "mutation",
  "tags": ["create", "HITL", "deal"],
  "input": {
    "user_message": "Create a new deal for acquiring DataSync Inc, estimated value $500k",
    "context": {}
  },
  "expected": {
    "tool_calls": [
      {
        "tool_name": "create_deal",
        "required_parameters": ["name"]
      }
    ],
    "requires_approval": true
  },
  "mock_response": {
    "tool_calls": [
      {
        "tool_name": "create_deal",
        "parameters": {
          "name": "DataSync Inc",
          "value": 500000
        }
      }
    ],
    "response_text": "I'll create a new deal for DataSync Inc with an estimated value of $500,000. This requires your approval.",
    "requires_approval": true
  },
  "metadata": {
    "created_at": "2026-02-05",
    "author": "R3 Remediation",
    "jira_ticket": "ZK-BRAIN-P4.5"
  }
}
