{
  "id": "GT-026",
  "version": "1.0",
  "name": "Grounding - deal contacts query",
  "description": "User asks about contacts for a deal - must ground with get_deal first",
  "category": "query",
  "tags": ["grounding", "contacts", "deal"],
  "input": {
    "user_message": "Who is the main contact for the CloudTech deal?",
    "context": {
      "deal_id": "DL-0056",
      "deal_name": "CloudTech"
    }
  },
  "expected": {
    "tool_calls": [
      {
        "tool_name": "get_deal",
        "required_parameters": ["deal_id"]
      }
    ],
    "requires_approval": false
  },
  "mock_response": {
    "tool_calls": [
      {
        "tool_name": "get_deal",
        "parameters": {
          "deal_id": "DL-0056"
        }
      }
    ],
    "response_text": "The main contact for the CloudTech deal is John Smith, CEO (john@cloudtech.com).",
    "requires_approval": false
  },
  "metadata": {
    "created_at": "2026-02-05",
    "author": "R3 Remediation",
    "jira_ticket": "ZK-BRAIN-P4.5"
  }
}
