{
  "id": "GT-020",
  "version": "1.0",
  "name": "Add note to deal",
  "description": "User wants to add a note to a deal",
  "category": "mutation",
  "tags": ["note", "add_note", "HITL"],
  "input": {
    "user_message": "Add a note to deal DL-0033: 'Follow up scheduled for next week regarding financials'",
    "context": {
      "deal_id": "DL-0033"
    }
  },
  "expected": {
    "tool_calls": [
      {
        "tool_name": "add_note",
        "required_parameters": ["deal_id", "note"]
      }
    ],
    "requires_approval": true
  },
  "mock_response": {
    "tool_calls": [
      {
        "tool_name": "add_note",
        "parameters": {
          "deal_id": "DL-0033",
          "note": "Follow up scheduled for next week regarding financials"
        }
      }
    ],
    "response_text": "I'll add that note to deal DL-0033. This requires your approval.",
    "requires_approval": true
  },
  "metadata": {
    "created_at": "2026-02-05",
    "author": "R3 Remediation",
    "jira_ticket": "ZK-BRAIN-P4.5"
  }
}
